{
  "$schema": "https://json-schema.org/draft/2020-12/schema",
  "$id": "https://orion.local/schema/plugin.json",
  "type": "object",
  "required": ["id", "name", "summary", "license", "repository"],
  "properties": {
    "id": { "type": "string", "pattern": "^[a-z0-9]+(?:-[a-z0-9]+)*$" },
    "name": { "type": "string", "minLength": 1 },
    "summary": { "type": "string", "minLength": 1 },
    "author": { "type": "string" },
    "official": { "type": "boolean" },
    "license": { "type": "string" },
    "repository": { "type": "string", "format": "uri" },
    "homepage": { "type": "string" },
    "capabilities": {
      "type": "array",
      "items": { "type": "string" }
    }
  }
}
